{
  "cell_id": "knowledge_ai_001",
  "cell_type": "ai_knowledge_observer",
  "domain": "enterprise_knowledge_governance",
  "certification": {
    "issuer_type": "enterprise",
    "issuer_id": "enterprise_cert_node_001",
    "trust_domain": "example.enterprise.internal",
    "certification_scope": "enterprise_private"
  },
  "capability_scope": [
    "explain_public_policy",
    "collect_required_materials"
  ],
  "boundary_scope": [
    "no_refund_commitment_without_authority"
  ],
  "forbidden_claims": [
    "full_refund_without_authority"
  ],
  "unknown_policy": "declare_unknown_and_escalate",
  "human_anchor": {
    "anchor_type": "role",
    "anchor_id": "knowledge_governance_owner"
  },
  "lifecycle": {
    "status": "active",
    "exit_policy": "graceful_shutdown_with_audit_snapshot"
  },
  "relationships": [
    {
      "relation_type": "declared_for",
      "target_type": "raw_input",
      "target_id": "raw_knowledge_001"
    }
  ],
  "subject_ref": {
    "id": "none",
    "mode": "none",
    "declaration_id": "none",
    "digest": "none",
    "external_effect": false
  }
}
